<?xml version="1.0" encoding="UTF-8"?>
<shipOrder xmlns:xsi="http://www.w3.org/2001/XMLSchema-instance"  
xsi:noNamespaceSchemaLocation="ship.xsd">

  <shipTo>
    <name>Tove Svendson</name>
    <street>Ragnhildvei 2</street>
    <address>4000 Stavanger</address>
    <state><USState>texes</USState></state>
    <country>US</country>
  </shipTo>
  <items>
    <item>
      <title>Empire Burlesque</title>
      <quantity>10</quantity>
      <price>55</price>
      <ddate>2021-06-25</ddate>
    </item>
    <item>
      <title>Hide your heart</title>
      <quantity>1</quantity>
      <price>9.90</price>
      <ddate>2021-06-25</ddate>
    </item>
  </items>
</shipOrder>